### ISSUE TITLE
pfsense OpenVPN Remote Access Server + UPnP/NAT-PMP

### ISSUE THREAD

**Issue by kevindd992002** [miniupnp/miniupnp#444]
Do UPnP and NAT-PMP work over an OpenVPN connection? I have a OpenVPN remote access server setup on my pfsense box and UPnP/NAT-PMP enabled and configure for the OpenVPN interface. I then tested the connection with one remote client and I see that the uTorrent listening port on that remote client gets forwarded properly in the OpenVPN server but when I fire up games like COD: MW I don't see port forward entries for it under Status -> UPnP & NAT-PMP. So what gives?
Top

**Comment by mstargard** [comment]
Have a look at #433

**Comment by kevindd992002** [comment]
I'm familiar with that issue but that only happens when the WAN interface (external interface of UPNP) is a private IP, right? I had a private IP a few days ago (because of an issue I'm troubleshooting with my ISP) but have a public IP since then. All local networks use UPNP just fine now and utorrent over a remote OpenVPN user. But for some reason, COD from that same remote OpenVPN user us not successful in port forwarding.

**Comment by kevindd992002** [comment]
@miniupnp, can this issue be related to #433?

**Comment by miniupnp** [comment]
It is hard to tell without more details on your network setup.
Also you should capture network traffic during utorrent startup and during the game startup.

first focus on SSDP packets (UDP port 1900) :
```
$ sudo tshark udp port 1900
Capturing on 'em0'
    1 0.000000000 192.168.10.70 → 239.255.255.250 SSDP 179 M-SEARCH * HTTP/1.1 
    2 0.001056358 192.16
```8.10.254 → 192.168.10.70 SSDP 345 HTTP/1.1 200 OK

**Comment by miniupnp** [comment]
utorrent may also use NAT PMP (UDP port 5351)

**Comment by kevindd992002** [comment]
Here are some pfsense packet captures on the openvpn interface (ports 2189, 1900, or 5351):

10.0.1.1 -> openvpn gateway IP
10.0.1.101 -> openvpn client IP

1. While uTorrent and the game NOT running:

```
00:41:37.878853 IP 10.0.1.1.12434 > 239.255.255.250.1900: UDP, length 398
00:41:37.878942 IP 10.0.1.1.12434 > 239.255.255.250.1900: UDP, length 470
00:41:37.878995 IP 10.0.1.1.12434 > 239.255.255.250.1900: UDP, length 406
00:41:37.879045 IP 10.0.1.1.12434 > 239.255.255.250.1900: UDP, length 466
00:41:37.879092 IP 10.0.1.1.12434 > 239.255.255.250.1900: UDP, length 406
00:41:37.879142 IP 10.0.1.1.12434 > 239.255.255.250.1900: UDP, length 446
00:41:37.879190 IP 10.0.1.1.12434 > 239.255.255.250.1900: UDP, length 406
00:41:37.879237 IP 10.0.1.1.12434 > 239.255.255.250.1900: UDP, length 460
00:41:37.879285 IP 10.0.1.1.12434 > 239.255.255.250.1900: UDP, length 478
00:41:37.879334 IP 10.0.1.1.12434 > 239.255.255.250.1900: UDP, length 462
00:41:37.879387 IP 10.0.1.1.12434 > 239.255.255.250.1900: UDP, length 462
00:41:38.146727 IP 10.0.1.1.12434 > 239.255.255.250.1900: UDP, length 462
00:41:38.146781 IP 10.0.1.1.12434 > 239.255.255.250.1900: UDP, length 462
00:41:38.146805 IP 10.0.1.1.12434 > 239.255.255.250.1900: UDP, length 478
00:41:38.146828 IP 10.0.1.1.12434 > 239.255.255.250.1900: UDP, length 460
00:41:38.146852 IP 10.0.1.1.12434 > 239.255.255.250.1900: UDP, length 406
00:41:38.146878 IP 10.0.1.1.12434 > 239.255.255.250.1900: UDP, length 446
00:41:38.146901 IP 10.0.1.1.12434 > 239.255.255.250.1900: UDP, length 406
00:41:38.146924 IP 10.0.1.1.12434 > 239.255.255.250.1900: UDP, length 466
00:41:38.146947 IP 10.0.1.1.12434 > 239.255.255.250.1900: UDP, length 406
00:41:38.146970 IP 10.0.1.1.12434 > 239.255.255.250.1900: UDP, length 470
00:41:38.146996 IP 10.0.1.1.12434 > 239.255.255.250.1900: UDP, length 398
```

2. Upon uTorrent booting up (game still closed) and successfully mapping the port:

```
00:43:05.529422 IP 10.0.1.101.63558 > 10.0.1.1.2189: tcp 0
00:43:05.529707 IP 10.0.1.1.2189 > 10.0.1.101.63558: tcp 0
00:43:05.530175 IP 10.0.1.101.63558 > 10.0.1.1.2189: tcp 0
00:43:05.534483 IP 10.0.1.101.63558 > 10.0.1.1.2189: tcp 70
00:43:05.534573 IP 10.0.1.1.2189 > 10.0.1.101.63558: tcp 0
00:43:05.534765 IP 10.0.1.1.2189 > 10.0.1.101.63558: tcp 1288
00:43:05.534792 IP 10.0.1.1.2189 > 10.0.1.101.63558: tcp 1288
00:43:05.534816 IP 10.0.1.1.2189 > 10.0.1.101.63558: tcp 175
00:43:05.534866 IP 10.0.1.1.2189 > 10.0.1.101.63558: tcp 0
00:43:05.535595 IP 10.0.1.101.63558 > 10.0.1.1.2189: tcp 0
00:43:05.535958 IP 10.0.1.101.63558 > 10.0.1.1.2189: tcp 0
00:43:05.536219 IP 10.0.1.101.63558 > 10.0.1.1.2189: tcp 0
00:43:05.536315 IP 10.0.1.101.63558 > 10.0.1.1.2189: tcp 0
00:43:05.536422 IP 10.0.1.101.63559 > 10.0.1.1.2189: tcp 0
00:43:05.536553 IP 10.0.1.1.2189 > 10.0.1.101.63559: tcp 0
00:43:05.536890 IP 10.0.1.101.63559 > 10.0.1.1.2189: tcp 0
00:43:05.537214 IP 10.0.1.101.63559 > 10.0.1.1.2189: tcp 552
00:43:05.537287 IP 10.0.1.1.2189 > 10.0.1.101.63559: tcp 0
00:43:05.537617 IP 10.0.1.1.2189 > 10.0.1.101.63559: tcp 797
00:43:05.537658 IP 10.0.1.1.2189 > 10.0.1.101.63559: tcp 0
00:43:05.538017 IP 10.0.1.101.63559 > 10.0.1.1.2189: tcp 0
00:43:05.538602 IP 10.0.1.101.63559 > 10.0.1.1.2189: tcp 0
00:43:05.538698 IP 10.0.1.101.63559 > 10.0.1.1.2189: tcp 0
00:43:05.538754 IP 10.0.1.1.2189 > 10.0.1.101.63559: tcp 0
00:43:05.538820 IP 10.0.1.101.63559 > 10.0.1.1.2189: tcp 0
00:43:05.538898 IP 10.0.1.101.63560 > 10.0.1.1.2189: tcp 0
00:43:05.538994 IP 10.0.1.1.2189 > 10.0.1.101.63560: tcp 0
00:43:05.539399 IP 10.0.1.101.63560 > 10.0.1.1.2189: tcp 0
00:43:05.539746 IP 10.0.1.101.63560 > 10.0.1.1.2189: tcp 552
00:43:05.539815 IP 10.0.1.1.2189 > 10.0.1.101.63560: tcp 0
00:43:05.540089 IP 10.0.1.1.2189 > 10.0.1.101.63560: tcp 797
00:43:05.540137 IP 10.0.1.1.2189 > 10.0.1.101.63560: tcp 0
00:43:05.540489 IP 10.0.1.101.63560 > 10.0.1.1.2189: tcp 0
00:43:05.540872 IP 10.0.1.101.63560 > 10.0.1.1.2189: tcp 0
00:43:05.540966 IP 10.0.1.101.63560 > 10.0.1.1.2189: tcp 0
00:43:05.541018 IP 10.0.1.1.2189 > 10.0.1.101.63560: tcp 0
00:43:05.541082 IP 10.0.1.101.63560 > 10.0.1.1.2189: tcp 0
00:43:05.541158 IP 10.0.1.101.63561 > 10.0.1.1.2189: tcp 0
00:43:05.541251 IP 10.0.1.1.2189 > 10.0.1.101.63561: tcp 0
00:43:05.541688 IP 10.0.1.101.63561 > 10.0.1.1.2189: tcp 0
00:43:05.541992 IP 10.0.1.101.63561 > 10.0.1.1.2189: tcp 552
00:43:05.542062 IP 10.0.1.1.2189 > 10.0.1.101.63561: tcp 0
00:43:05.542355 IP 10.0.1.1.2189 > 10.0.1.101.63561: tcp 797
00:43:05.542398 IP 10.0.1.1.2189 > 10.0.1.101.63561: tcp 0
00:43:05.542791 IP 10.0.1.101.63561 > 10.0.1.1.2189: tcp 0
00:43:05.543198 IP 10.0.1.101.63561 > 10.0.1.1.2189: tcp 0
00:43:05.543292 IP 10.0.1.101.63561 > 10.0.1.1.2189: tcp 0
00:43:05.543391 IP 10.0.1.101.63562 > 10.0.1.1.2189: tcp 0
00:43:05.543492 IP 10.0.1.1.2189 > 10.0.1.101.63562: tcp 0
00:43:05.543788 IP 10.0.1.101.63562 > 10.0.1.1.2189: tcp 0
00:43:05.544153 IP 10.0.1.101.63562 > 10.0.1.1.2189: tcp 552
00:43:05.544233 IP 10.0.1.1.2189 > 10.0.1.101.63562: tcp 0
00:43:05.544441 IP 10.0.1.1.2189 > 10.0.1.101.63562: tcp 794
00:43:05.544493 IP 10.0.1.1.2189 > 10.0.1.101.63562: tcp 0
00:43:05.544865 IP 10.0.1.101.63562 > 10.0.1.1.2189: tcp 0
00:43:05.545275 IP 10.0.1.101.63562 > 10.0.1.1.2189: tcp 0
00:43:05.545371 IP 10.0.1.101.63562 > 10.0.1.1.2189: tcp 0
00:43:05.545424 IP 10.0.1.1.2189 > 10.0.1.101.63562: tcp 0
00:43:05.545498 IP 10.0.1.101.63562 > 10.0.1.1.2189: tcp 0
00:43:05.545578 IP 10.0.1.101.63563 > 10.0.1.1.2189: tcp 0
00:43:05.545679 IP 10.0.1.1.2189 > 10.0.1.101.63563: tcp 0
00:43:05.546061 IP 10.0.1.101.63563 > 10.0.1.1.2189: tcp 0
00:43:05.546419 IP 10.0.1.101.63563 > 10.0.1.1.2189: tcp 552
00:43:05.546498 IP 10.0.1.1.2189 > 10.0.1.101.63563: tcp 0
00:43:05.546712 IP 10.0.1.1.2189 > 10.0.1.101.63563: tcp 794
00:43:05.546755 IP 10.0.1.1.2189 > 10.0.1.101.63563: tcp 0
00:43:05.547111 IP 10.0.1.101.63563 > 10.0.1.1.2189: tcp 0
00:43:05.547537 IP 10.0.1.101.63563 > 10.0.1.1.2189: tcp 0
00:43:05.547629 IP 10.0.1.101.63563 > 10.0.1.1.2189: tcp 0
00:43:05.547732 IP 10.0.1.101.63564 > 10.0.1.1.2189: tcp 0
00:43:05.547841 IP 10.0.1.1.2189 > 10.0.1.101.63564: tcp 0
00:43:05.548130 IP 10.0.1.101.63564 > 10.0.1.1.2189: tcp 0
00:43:05.548521 IP 10.0.1.101.63564 > 10.0.1.1.2189: tcp 552
00:43:05.548600 IP 10.0.1.1.2189 > 10.0.1.101.63564: tcp 0
00:43:05.548867 IP 10.0.1.1.2189 > 10.0.1.101.63564: tcp 794
00:43:05.548912 IP 10.0.1.1.2189 > 10.0.1.101.63564: tcp 0
00:43:05.549277 IP 10.0.1.101.63564 > 10.0.1.1.2189: tcp 0
00:43:05.549675 IP 10.0.1.101.63564 > 10.0.1.1.2189: tcp 0
00:43:05.549772 IP 10.0.1.101.63564 > 10.0.1.1.2189: tcp 0
00:43:05.549876 IP 10.0.1.101.63565 > 10.0.1.1.2189: tcp 0
00:43:05.550008 IP 10.0.1.1.2189 > 10.0.1.101.63565: tcp 0
00:43:05.550311 IP 10.0.1.101.63565 > 10.0.1.1.2189: tcp 0
00:43:05.550642 IP 10.0.1.101.63565 > 10.0.1.1.2189: tcp 552
00:43:05.550718 IP 10.0.1.1.2189 > 10.0.1.101.63565: tcp 0
00:43:05.551122 IP 10.0.1.1.2189 > 10.0.1.101.63565: tcp 794
00:43:05.551184 IP 10.0.1.1.2189 > 10.0.1.101.63565: tcp 0
00:43:05.551597 IP 10.0.1.101.63565 > 10.0.1.1.2189: tcp 0
00:43:05.552031 IP 10.0.1.101.63565 > 10.0.1.1.2189: tcp 0
00:43:05.552127 IP 10.0.1.101.63565 > 10.0.1.1.2189: tcp 0
00:43:05.552237 IP 10.0.1.101.63566 > 10.0.1.1.2189: tcp 0
00:43:05.552384 IP 10.0.1.1.2189 > 10.0.1.101.63566: tcp 0
00:43:05.552717 IP 10.0.1.101.63566 > 10.0.1.1.2189: tcp 0
00:43:05.553131 IP 10.0.1.101.63566 > 10.0.1.1.2189: tcp 552
00:43:05.553220 IP 10.0.1.1.2189 > 10.0.1.101.63566: tcp 0
00:43:05.553554 IP 10.0.1.1.2189 > 10.0.1.101.63566: tcp 803
00:43:05.553603 IP 10.0.1.1.2189 > 10.0.1.101.63566: tcp 0
00:43:05.553982 IP 10.0.1.101.63566 > 10.0.1.1.2189: tcp 0
00:43:05.554444 IP 10.0.1.101.63566 > 10.0.1.1.2189: tcp 0
00:43:05.554549 IP 10.0.1.101.63566 > 10.0.1.1.2189: tcp 0
00:43:05.554611 IP 10.0.1.1.2189 > 10.0.1.101.63566: tcp 0
00:43:05.554680 IP 10.0.1.101.63566 > 10.0.1.1.2189: tcp 0
00:43:05.554763 IP 10.0.1.101.63567 > 10.0.1.1.2189: tcp 0
00:43:05.554918 IP 10.0.1.1.2189 > 10.0.1.101.63567: tcp 0
00:43:05.555300 IP 10.0.1.101.63567 > 10.0.1.1.2189: tcp 0
00:43:05.555666 IP 10.0.1.101.63567 > 10.0.1.1.2189: tcp 552
00:43:05.555749 IP 10.0.1.1.2189 > 10.0.1.101.63567: tcp 0
00:43:05.556092 IP 10.0.1.1.2189 > 10.0.1.101.63567: tcp 803
00:43:05.556145 IP 10.0.1.1.2189 > 10.0.1.101.63567: tcp 0
00:43:05.556515 IP 10.0.1.101.63567 > 10.0.1.1.2189: tcp 0
00:43:05.556931 IP 10.0.1.101.63567 > 10.0.1.1.2189: tcp 0
00:43:05.557025 IP 10.0.1.101.63567 > 10.0.1.1.2189: tcp 0
00:43:05.557137 IP 10.0.1.101.63568 > 10.0.1.1.2189: tcp 0
00:43:05.557288 IP 10.0.1.1.2189 > 10.0.1.101.63568: tcp 0
00:43:05.557586 IP 10.0.1.101.63568 > 10.0.1.1.2189: tcp 0
00:43:05.557939 IP 10.0.1.101.63568 > 10.0.1.1.2189: tcp 552
00:43:05.558030 IP 10.0.1.1.2189 > 10.0.1.101.63568: tcp 0
00:43:05.558378 IP 10.0.1.1.2189 > 10.0.1.101.63568: tcp 794
00:43:05.558426 IP 10.0.1.1.2189 > 10.0.1.101.63568: tcp 0
00:43:05.558822 IP 10.0.1.101.63568 > 10.0.1.1.2189: tcp 0
00:43:05.559248 IP 10.0.1.101.63568 > 10.0.1.1.2189: tcp 0
00:43:05.559382 IP 10.0.1.101.63568 > 10.0.1.1.2189: tcp 0
00:43:05.559449 IP 10.0.1.1.2189 > 10.0.1.101.63568: tcp 0
00:43:05.559539 IP 10.0.1.101.63568 > 10.0.1.1.2189: tcp 0
00:43:05.559624 IP 10.0.1.101.63569 > 10.0.1.1.2189: tcp 0
00:43:05.559762 IP 10.0.1.1.2189 > 10.0.1.101.63569: tcp 0
00:43:05.560163 IP 10.0.1.101.63569 > 10.0.1.1.2189: tcp 0
00:43:05.560511 IP 10.0.1.101.63569 > 10.0.1.1.2189: tcp 553
00:43:05.560602 IP 10.0.1.1.2189 > 10.0.1.101.63569: tcp 0
00:43:05.560961 IP 10.0.1.1.2189 > 10.0.1.101.63569: tcp 794
00:43:05.561008 IP 10.0.1.1.2189 > 10.0.1.101.63569: tcp 0
00:43:05.561373 IP 10.0.1.101.63569 > 10.0.1.1.2189: tcp 0
00:43:05.561813 IP 10.0.1.101.63569 > 10.0.1.1.2189: tcp 0
00:43:05.561909 IP 10.0.1.101.63569 > 10.0.1.1.2189: tcp 0
00:43:05.562010 IP 10.0.1.101.63570 > 10.0.1.1.2189: tcp 0
00:43:05.562156 IP 10.0.1.1.2189 > 10.0.1.101.63570: tcp 0
00:43:05.562451 IP 10.0.1.101.63570 > 10.0.1.1.2189: tcp 0
00:43:05.562775 IP 10.0.1.101.63570 > 10.0.1.1.2189: tcp 553
00:43:05.562852 IP 10.0.1.1.2189 > 10.0.1.101.63570: tcp 0
00:43:05.563187 IP 10.0.1.1.2189 > 10.0.1.101.63570: tcp 794
00:43:05.563234 IP 10.0.1.1.2189 > 10.0.1.101.63570: tcp 0
00:43:05.563593 IP 10.0.1.101.63570 > 10.0.1.1.2189: tcp 0
00:43:05.563971 IP 10.0.1.101.63570 > 10.0.1.1.2189: tcp 0
00:43:05.564069 IP 10.0.1.101.63570 > 10.0.1.1.2189: tcp 0
00:43:05.564127 IP 10.0.1.1.2189 > 10.0.1.101.63570: tcp 0
00:43:05.564195 IP 10.0.1.101.63570 > 10.0.1.1.2189: tcp 0
00:43:05.564275 IP 10.0.1.101.63571 > 10.0.1.1.2189: tcp 0
00:43:05.564412 IP 10.0.1.1.2189 > 10.0.1.101.63571: tcp 0
00:43:05.564817 IP 10.0.1.101.63571 > 10.0.1.1.2189: tcp 0
00:43:05.565182 IP 10.0.1.101.63571 > 10.0.1.1.2189: tcp 553
00:43:05.565278 IP 10.0.1.1.2189 > 10.0.1.101.63571: tcp 0
00:43:05.565668 IP 10.0.1.1.2189 > 10.0.1.101.63571: tcp 794
00:43:05.565716 IP 10.0.1.1.2189 > 10.0.1.101.63571: tcp 0
00:43:05.566177 IP 10.0.1.101.63571 > 10.0.1.1.2189: tcp 0
00:43:05.566440 IP 10.0.1.101.63571 > 10.0.1.1.2189: tcp 0
00:43:05.566549 IP 10.0.1.101.63571 > 10.0.1.1.2189: tcp 0
00:43:05.566652 IP 10.0.1.101.63572 > 10.0.1.1.2189: tcp 0
00:43:05.566801 IP 10.0.1.1.2189 > 10.0.1.101.63572: tcp 0
00:43:05.567097 IP 10.0.1.101.63572 > 10.0.1.1.2189: tcp 0
00:43:05.567440 IP 10.0.1.101.63572 > 10.0.1.1.2189: tcp 553
00:43:05.567524 IP 10.0.1.1.2189 > 10.0.1.101.63572: tcp 0
00:43:05.567862 IP 10.0.1.1.2189 > 10.0.1.101.63572: tcp 794
00:43:05.567912 IP 10.0.1.1.2189 > 10.0.1.101.63572: tcp 0
00:43:05.568271 IP 10.0.1.101.63572 > 10.0.1.1.2189: tcp 0
00:43:05.568613 IP 10.0.1.101.63572 > 10.0.1.1.2189: tcp 0
00:43:05.568707 IP 10.0.1.101.63572 > 10.0.1.1.2189: tcp 0
00:43:05.568766 IP 10.0.1.1.2189 > 10.0.1.101.63572: tcp 0
00:43:05.568837 IP 10.0.1.101.63572 > 10.0.1.1.2189: tcp 0
00:43:05.568915 IP 10.0.1.101.63573 > 10.0.1.1.2189: tcp 0
00:43:05.569046 IP 10.0.1.1.2189 > 10.0.1.101.63573: tcp 0
00:43:05.569441 IP 10.0.1.101.63573 > 10.0.1.1.2189: tcp 0
00:43:05.569841 IP 10.0.1.101.63573 > 10.0.1.1.2189: tcp 553
00:43:05.569923 IP 10.0.1.1.2189 > 10.0.1.101.63573: tcp 0
00:43:05.570350 IP 10.0.1.1.2189 > 10.0.1.101.63573: tcp 794
00:43:05.570395 IP 10.0.1.1.2189 > 10.0.1.101.63573: tcp 0
00:43:05.571125 IP 10.0.1.101.63573 > 10.0.1.1.2189: tcp 0
00:43:05.571538 IP 10.0.1.101.63573 > 10.0.1.1.2189: tcp 0
00:43:05.571634 IP 10.0.1.101.63573 > 10.0.1.1.2189: tcp 0
00:43:05.571740 IP 10.0.1.101.63574 > 10.0.1.1.2189: tcp 0
00:43:05.571911 IP 10.0.1.1.2189 > 10.0.1.101.63574: tcp 0
00:43:05.572210 IP 10.0.1.101.63574 > 10.0.1.1.2189: tcp 0
00:43:05.572573 IP 10.0.1.101.63574 > 10.0.1.1.2189: tcp 553
00:43:05.572661 IP 10.0.1.1.2189 > 10.0.1.101.63574: tcp 0
00:43:05.573093 IP 10.0.1.1.2189 > 10.0.1.101.63574: tcp 794
00:43:05.573151 IP 10.0.1.1.2189 > 10.0.1.101.63574: tcp 0
00:43:05.573558 IP 10.0.1.101.63574 > 10.0.1.1.2189: tcp 0
00:43:05.573914 IP 10.0.1.101.63574 > 10.0.1.1.2189: tcp 0
00:43:05.574010 IP 10.0.1.101.63574 > 10.0.1.1.2189: tcp 0
00:43:05.574111 IP 10.0.1.101.63575 > 10.0.1.1.2189: tcp 0
00:43:05.574245 IP 10.0.1.1.2189 > 10.0.1.101.63575: tcp 0
00:43:05.574553 IP 10.0.1.101.63575 > 10.0.1.1.2189: tcp 0
00:43:05.574960 IP 10.0.1.101.63575 > 10.0.1.1.2189: tcp 553
00:43:05.575045 IP 10.0.1.1.2189 > 10.0.1.101.63575: tcp 0
00:43:05.575355 IP 10.0.1.1.2189 > 10.0.1.101.63575: tcp 794
00:43:05.575401 IP 10.0.1.1.2189 > 10.0.1.101.63575: tcp 0
00:43:05.575772 IP 10.0.1.101.63575 > 10.0.1.1.2189: tcp 0
00:43:05.576181 IP 10.0.1.101.63575 > 10.0.1.1.2189: tcp 0
00:43:05.576272 IP 10.0.1.101.63575 > 10.0.1.1.2189: tcp 0
00:43:05.576371 IP 10.0.1.101.63576 > 10.0.1.1.2189: tcp 0
00:43:05.576519 IP 10.0.1.1.2189 > 10.0.1.101.63576: tcp 0
00:43:05.576817 IP 10.0.1.101.63576 > 10.0.1.1.2189: tcp 0
00:43:05.577206 IP 10.0.1.101.63576 > 10.0.1.1.2189: tcp 553
00:43:05.577276 IP 10.0.1.1.2189 > 10.0.1.101.63576: tcp 0
00:43:05.577586 IP 10.0.1.1.2189 > 10.0.1.101.63576: tcp 794
00:43:05.577634 IP 10.0.1.1.2189 > 10.0.1.101.63576: tcp 0
00:43:05.577987 IP 10.0.1.101.63576 > 10.0.1.1.2189: tcp 0
00:43:05.578407 IP 10.0.1.101.63576 > 10.0.1.1.2189: tcp 0
00:43:05.578779 IP 10.0.1.101.63576 > 10.0.1.1.2189: tcp 0
00:43:05.578851 IP 10.0.1.1.2189 > 10.0.1.101.63576: tcp 0
00:43:05.578939 IP 10.0.1.101.63576 > 10.0.1.1.2189: tcp 0
00:43:05.579082 IP 10.0.1.101.63577 > 10.0.1.1.2189: tcp 0
00:43:05.579280 IP 10.0.1.1.2189 > 10.0.1.101.63577: tcp 0
00:43:05.580087 IP 10.0.1.101.63577 > 10.0.1.1.2189: tcp 0
00:43:05.580488 IP 10.0.1.101.63577 > 10.0.1.1.2189: tcp 553
00:43:05.580579 IP 10.0.1.1.2189 > 10.0.1.101.63577: tcp 0
00:43:05.581116 IP 10.0.1.1.2189 > 10.0.1.101.63577: tcp 794
00:43:05.581166 IP 10.0.1.1.2189 > 10.0.1.101.63577: tcp 0
00:43:05.581664 IP 10.0.1.101.63577 > 10.0.1.1.2189: tcp 0
00:43:05.581962 IP 10.0.1.101.63577 > 10.0.1.1.2189: tcp 0
00:43:05.582061 IP 10.0.1.101.63577 > 10.0.1.1.2189: tcp 0
00:43:05.582124 IP 10.0.1.1.2189 > 10.0.1.101.63577: tcp 0
00:43:05.582193 IP 10.0.1.101.63577 > 10.0.1.1.2189: tcp 0
00:43:05.582276 IP 10.0.1.101.63579 > 10.0.1.1.2189: tcp 0
00:43:05.582426 IP 10.0.1.1.2189 > 10.0.1.101.63579: tcp 0
00:43:05.582836 IP 10.0.1.101.63579 > 10.0.1.1.2189: tcp 0
00:43:05.583184 IP 10.0.1.101.63579 > 10.0.1.1.2189: tcp 553
00:43:05.583329 IP 10.0.1.1.2189 > 10.0.1.101.63579: tcp 0
00:43:05.583747 IP 10.0.1.1.2189 > 10.0.1.101.63579: tcp 794
00:43:05.583801 IP 10.0.1.1.2189 > 10.0.1.101.63579: tcp 0
00:43:05.584357 IP 10.0.1.101.63579 > 10.0.1.1.2189: tcp 0
00:43:05.584550 IP 10.0.1.101.63579 > 10.0.1.1.2189: tcp 0
00:43:05.584683 IP 10.0.1.101.63579 > 10.0.1.1.2189: tcp 0
00:43:05.584776 IP 10.0.1.1.2189 > 10.0.1.101.63579: tcp 0
00:43:05.584848 IP 10.0.1.101.63579 > 10.0.1.1.2189: tcp 0
00:43:05.584948 IP 10.0.1.101.63580 > 10.0.1.1.2189: tcp 0
00:43:05.585096 IP 10.0.1.1.2189 > 10.0.1.101.63580: tcp 0
00:43:05.585516 IP 10.0.1.101.63580 > 10.0.1.1.2189: tcp 0
00:43:05.585861 IP 10.0.1.101.63580 > 10.0.1.1.2189: tcp 553
00:43:05.585952 IP 10.0.1.1.2189 > 10.0.1.101.63580: tcp 0
00:43:05.586276 IP 10.0.1.1.2189 > 10.0.1.101.63580: tcp 794
00:43:05.586329 IP 10.0.1.1.2189 > 10.0.1.101.63580: tcp 0
00:43:05.586709 IP 10.0.1.101.63580 > 10.0.1.1.2189: tcp 0
00:43:05.587086 IP 10.0.1.101.63580 > 10.0.1.1.2189: tcp 0
00:43:05.587184 IP 10.0.1.101.63580 > 10.0.1.1.2189: tcp 0
00:43:05.587291 IP 10.0.1.101.63581 > 10.0.1.1.2189: tcp 0
00:43:05.587447 IP 10.0.1.1.2189 > 10.0.1.101.63581: tcp 0
00:43:05.587765 IP 10.0.1.101.63581 > 10.0.1.1.2189: tcp 0
00:43:05.588153 IP 10.0.1.101.63581 > 10.0.1.1.2189: tcp 553
00:43:05.588227 IP 10.0.1.1.2189 > 10.0.1.101.63581: tcp 0
00:43:05.588480 IP 10.0.1.1.2189 > 10.0.1.101.63581: tcp 794
00:43:05.588526 IP 10.0.1.1.2189 > 10.0.1.101.63581: tcp 0
00:43:05.588898 IP 10.0.1.101.63581 > 10.0.1.1.2189: tcp 0
00:43:05.589383 IP 10.0.1.101.63581 > 10.0.1.1.2189: tcp 0
00:43:05.589487 IP 10.0.1.101.63581 > 10.0.1.1.2189: tcp 0
00:43:05.589593 IP 10.0.1.101.63582 > 10.0.1.1.2189: tcp 0
00:43:05.589744 IP 10.0.1.1.2189 > 10.0.1.101.63582: tcp 0
00:43:05.590054 IP 10.0.1.101.63582 > 10.0.1.1.2189: tcp 0
00:43:05.590384 IP 10.0.1.101.63582 > 10.0.1.1.2189: tcp 553
00:43:05.590483 IP 10.0.1.1.2189 > 10.0.1.101.63582: tcp 0
00:43:05.590773 IP 10.0.1.1.2189 > 10.0.1.101.63582: tcp 794
00:43:05.590819 IP 10.0.1.1.2189 > 10.0.1.101.63582: tcp 0
00:43:05.591188 IP 10.0.1.101.63582 > 10.0.1.1.2189: tcp 0
00:43:05.591581 IP 10.0.1.101.63582 > 10.0.1.1.2189: tcp 0
00:43:05.591686 IP 10.0.1.101.63582 > 10.0.1.1.2189: tcp 0
00:43:05.591798 IP 10.0.1.101.63583 > 10.0.1.1.2189: tcp 0
00:43:05.591915 IP 10.0.1.1.2189 > 10.0.1.101.63583: tcp 0
00:43:05.592231 IP 10.0.1.101.63583 > 10.0.1.1.2189: tcp 0
00:43:05.592573 IP 10.0.1.101.63583 > 10.0.1.1.2189: tcp 553
00:43:05.592664 IP 10.0.1.1.2189 > 10.0.1.101.63583: tcp 0
00:43:05.592944 IP 10.0.1.1.2189 > 10.0.1.101.63583: tcp 587
00:43:05.592993 IP 10.0.1.1.2189 > 10.0.1.101.63583: tcp 0
00:43:05.593350 IP 10.0.1.101.63583 > 10.0.1.1.2189: tcp 0
00:43:05.593698 IP 10.0.1.101.63583 > 10.0.1.1.2189: tcp 0
00:43:05.593794 IP 10.0.1.101.63583 > 10.0.1.1.2189: tcp 0
00:43:05.593859 IP 10.0.1.1.2189 > 10.0.1.101.63583: tcp 0
00:43:05.593927 IP 10.0.1.101.63583 > 10.0.1.1.2189: tcp 0
00:43:05.594012 IP 10.0.1.101.63584 > 10.0.1.1.2189: tcp 0
00:43:05.594155 IP 10.0.1.1.2189 > 10.0.1.101.63584: tcp 0
00:43:05.594591 IP 10.0.1.101.63584 > 10.0.1.1.2189: tcp 0
00:43:05.595002 IP 10.0.1.101.63584 > 10.0.1.1.2189: tcp 795
00:43:05.595080 IP 10.0.1.1.2189 > 10.0.1.101.63584: tcp 0
00:43:05.596394 IP 10.0.1.1.2189 > 10.0.1.101.63584: tcp 421
00:43:05.596445 IP 10.0.1.1.2189 > 10.0.1.101.63584: tcp 0
00:43:05.596892 IP 10.0.1.101.63584 > 10.0.1.1.2189: tcp 0
00:43:05.597376 IP 10.0.1.101.63584 > 10.0.1.1.2189: tcp 0
00:43:05.597487 IP 10.0.1.101.63584 > 10.0.1.1.2189: tcp 0
00:43:05.597579 IP 10.0.1.1.2189 > 10.0.1.101.63584: tcp 0
00:43:05.597652 IP 10.0.1.101.63584 > 10.0.1.1.2189: tcp 0
00:43:05.597747 IP 10.0.1.101.63585 > 10.0.1.1.2189: tcp 0
00:43:05.597905 IP 10.0.1.1.2189 > 10.0.1.101.63585: tcp 0
00:43:05.598309 IP 10.0.1.101.63585 > 10.0.1.1.2189: tcp 0
00:43:05.598666 IP 10.0.1.101.63585 > 10.0.1.1.2189: tcp 795
00:43:05.598768 IP 10.0.1.1.2189 > 10.0.1.101.63585: tcp 0
00:43:05.603517 IP 10.0.1.1.2189 > 10.0.1.101.63585: tcp 421
00:43:05.603570 IP 10.0.1.1.2189 > 10.0.1.101.63585: tcp 0
00:43:05.604004 IP 10.0.1.101.63585 > 10.0.1.1.2189: tcp 0
00:43:05.604492 IP 10.0.1.101.63585 > 10.0.1.1.2189: tcp 0
00:43:05.604640 IP 10.0.1.101.63585 > 10.0.1.1.2189: tcp 0
00:43:05.604715 IP 10.0.1.1.2189 > 10.0.1.101.63585: tcp 0
00:43:05.604787 IP 10.0.1.101.63585 > 10.0.1.1.2189: tcp 0
00:43:05.608304 IP 10.0.1.101.63586 > 10.0.1.1.2189: tcp 0
00:43:05.608554 IP 10.0.1.1.2189 > 10.0.1.101.63586: tcp 0
00:43:05.609056 IP 10.0.1.101.63586 > 10.0.1.1.2189: tcp 0
00:43:05.625629 IP 10.0.1.101.63586 > 10.0.1.1.2189: tcp 490
00:43:05.625775 IP 10.0.1.1.2189 > 10.0.1.101.63586: tcp 0
00:43:05.626145 IP 10.0.1.1.2189 > 10.0.1.101.63586: tcp 517
00:43:05.626200 IP 10.0.1.1.2189 > 10.0.1.101.63586: tcp 0
00:43:05.626594 IP 10.0.1.101.63586 > 10.0.1.1.2189: tcp 0
00:43:05.626977 IP 10.0.1.101.63586 > 10.0.1.1.2189: tcp 0
00:43:05.627079 IP 10.0.1.101.63586 > 10.0.1.1.2189: tcp 0
00:43:05.627145 IP 10.0.1.1.2189 > 10.0.1.101.63586: tcp 0
00:43:05.627217 IP 10.0.1.101.63586 > 10.0.1.1.2189: tcp 0
00:43:07.867023 IP 10.0.1.1.12434 > 239.255.255.250.1900: UDP, length 398
00:43:07.867100 IP 10.0.1.1.12434 > 239.255.255.250.1900: UDP, length 470
00:43:07.867145 IP 10.0.1.1.12434 > 239.255.255.250.1900: UDP, length 406
00:43:07.867195 IP 10.0.1.1.12434 > 239.255.255.250.1900: UDP, length 466
00:43:07.867239 IP 10.0.1.1.12434 > 239.255.255.250.1900: UDP, length 406
00:43:07.867285 IP 10.0.1.1.12434 > 239.255.255.250.1900: UDP, length 446
00:43:07.867329 IP 10.0.1.1.12434 > 239.255.255.250.1900: UDP, length 406
00:43:07.867375 IP 10.0.1.1.12434 > 239.255.255.250.1900: UDP, length 460
00:43:07.867422 IP 10.0.1.1.12434 > 239.255.255.250.1900: UDP, length 478
00:43:07.867468 IP 10.0.1.1.12434 > 239.255.255.250.1900: UDP, length 462
00:43:07.867522 IP 10.0.1.1.12434 > 239.255.255.250.1900: UDP, length 462
00:43:07.867879 IP 10.0.1.101.63612 > 10.0.1.1.2189: tcp 0
00:43:07.868076 IP 10.0.1.1.2189 > 10.0.1.101.63612: tcp 0
00:43:07.868715 IP 10.0.1.101.63612 > 10.0.1.1.2189: tcp 0
00:43:07.885313 IP 10.0.1.101.63612 > 10.0.1.1.2189: tcp 70
00:43:07.885446 IP 10.0.1.1.2189 > 10.0.1.101.63612: tcp 0
00:43:07.885689 IP 10.0.1.1.2189 > 10.0.1.101.63612: tcp 1288
00:43:07.885725 IP 10.0.1.1.2189 > 10.0.1.101.63612: tcp 1288
00:43:07.885746 IP 10.0.1.1.2189 > 10.0.1.101.63612: tcp 175
00:43:07.885786 IP 10.0.1.1.2189 > 10.0.1.101.63612: tcp 0
00:43:07.886133 IP 10.0.1.101.63612 > 10.0.1.1.2189: tcp 0
00:43:07.886354 IP 10.0.1.101.63612 > 10.0.1.1.2189: tcp 0
00:43:07.887049 IP 10.0.1.101.63612 > 10.0.1.1.2189: tcp 0
00:43:07.887155 IP 10.0.1.101.63612 > 10.0.1.1.2189: tcp 0
00:43:07.887260 IP 10.0.1.101.63613 > 10.0.1.1.2189: tcp 0
00:43:07.887424 IP 10.0.1.1.2189 > 10.0.1.101.63613: tcp 0
00:43:07.887813 IP 10.0.1.101.63613 > 10.0.1.1.2189: tcp 0
00:43:07.888235 IP 10.0.1.101.63613 > 10.0.1.1.2189: tcp 552
00:43:07.888328 IP 10.0.1.1.2189 > 10.0.1.101.63613: tcp 0
00:43:07.888744 IP 10.0.1.1.2189 > 10.0.1.101.63613: tcp 797
00:43:07.888790 IP 10.0.1.1.2189 > 10.0.1.101.63613: tcp 0
00:43:07.889209 IP 10.0.1.101.63613 > 10.0.1.1.2189: tcp 0
00:43:07.889672 IP 10.0.1.101.63613 > 10.0.1.1.2189: tcp 0
00:43:07.889771 IP 10.0.1.101.63613 > 10.0.1.1.2189: tcp 0
00:43:07.889827 IP 10.0.1.1.2189 > 10.0.1.101.63613: tcp 0
00:43:07.889894 IP 10.0.1.101.63613 > 10.0.1.1.2189: tcp 0
00:43:07.889975 IP 10.0.1.101.63614 > 10.0.1.1.2189: tcp 0
00:43:07.890073 IP 10.0.1.1.2189 > 10.0.1.101.63614: tcp 0
00:43:07.890471 IP 10.0.1.101.63614 > 10.0.1.1.2189: tcp 0
00:43:07.890812 IP 10.0.1.101.63614 > 10.0.1.1.2189: tcp 552
00:43:07.890879 IP 10.0.1.1.2189 > 10.0.1.101.63614: tcp 0
00:43:07.891194 IP 10.0.1.1.2189 > 10.0.1.101.63614: tcp 797
00:43:07.891238 IP 10.0.1.1.2189 > 10.0.1.101.63614: tcp 0
00:43:07.891705 IP 10.0.1.101.63614 > 10.0.1.1.2189: tcp 0
00:43:07.892023 IP 10.0.1.101.63614 > 10.0.1.1.2189: tcp 0
00:43:07.892115 IP 10.0.1.101.63614 > 10.0.1.1.2189: tcp 0
00:43:07.892211 IP 10.0.1.101.63615 > 10.0.1.1.2189: tcp 0
00:43:07.892298 IP 10.0.1.1.2189 > 10.0.1.101.63615: tcp 0
00:43:07.892638 IP 10.0.1.101.63615 > 10.0.1.1.2189: tcp 0
00:43:07.893016 IP 10.0.1.101.63615 > 10.0.1.1.2189: tcp 552
00:43:07.893081 IP 10.0.1.1.2189 > 10.0.1.101.63615: tcp 0
00:43:07.893325 IP 10.0.1.1.2189 > 10.0.1.101.63615: tcp 797
00:43:07.893371 IP 10.0.1.1.2189 > 10.0.1.101.63615: tcp 0
00:43:07.893739 IP 10.0.1.101.63615 > 10.0.1.1.2189: tcp 0
00:43:07.894162 IP 10.0.1.101.63615 > 10.0.1.1.2189: tcp 0
00:43:07.894254 IP 10.0.1.101.63615 > 10.0.1.1.2189: tcp 0
00:43:07.894347 IP 10.0.1.101.63616 > 10.0.1.1.2189: tcp 0
00:43:07.894427 IP 10.0.1.1.2189 > 10.0.1.101.63616: tcp 0
00:43:07.894733 IP 10.0.1.101.63616 > 10.0.1.1.2189: tcp 0
00:43:07.895085 IP 10.0.1.101.63616 > 10.0.1.1.2189: tcp 552
00:43:07.895163 IP 10.0.1.1.2189 > 10.0.1.101.63616: tcp 0
00:43:07.895392 IP 10.0.1.1.2189 > 10.0.1.101.63616: tcp 794
00:43:07.895438 IP 10.0.1.1.2189 > 10.0.1.101.63616: tcp 0
00:43:07.895813 IP 10.0.1.101.63616 > 10.0.1.1.2189: tcp 0
00:43:07.896204 IP 10.0.1.101.63616 > 10.0.1.1.2189: tcp 0
00:43:07.896295 IP 10.0.1.101.63616 > 10.0.1.1.2189: tcp 0
00:43:07.896387 IP 10.0.1.101.63617 > 10.0.1.1.2189: tcp 0
00:43:07.896476 IP 10.0.1.1.2189 > 10.0.1.101.63617: tcp 0
00:43:07.896773 IP 10.0.1.101.63617 > 10.0.1.1.2189: tcp 0
00:43:07.897111 IP 10.0.1.101.63617 > 10.0.1.1.2189: tcp 552
00:43:07.897193 IP 10.0.1.1.2189 > 10.0.1.101.63617: tcp 0
00:43:07.897446 IP 10.0.1.1.2189 > 10.0.1.101.63617: tcp 794
00:43:07.897499 IP 10.0.1.1.2189 > 10.0.1.101.63617: tcp 0
00:43:07.897838 IP 10.0.1.101.63617 > 10.0.1.1.2189: tcp 0
00:43:07.898215 IP 10.0.1.101.63617 > 10.0.1.1.2189: tcp 0
00:43:07.898307 IP 10.0.1.101.63617 > 10.0.1.1.2189: tcp 0
00:43:07.898400 IP 10.0.1.101.63618 > 10.0.1.1.2189: tcp 0
00:43:07.898486 IP 10.0.1.1.2189 > 10.0.1.101.63618: tcp 0
00:43:07.898781 IP 10.0.1.101.63618 > 10.0.1.1.2189: tcp 0
00:43:07.899120 IP 10.0.1.101.63618 > 10.0.1.1.2189: tcp 552
00:43:07.899199 IP 10.0.1.1.2189 > 10.0.1.101.63618: tcp 0
00:43:07.899461 IP 10.0.1.1.2189 > 10.0.1.101.63618: tcp 794
00:43:07.899504 IP 10.0.1.1.2189 > 10.0.1.101.63618: tcp 0
00:43:07.899865 IP 10.0.1.101.63618 > 10.0.1.1.2189: tcp 0
00:43:07.900240 IP 10.0.1.101.63618 > 10.0.1.1.2189: tcp 0
00:43:07.900330 IP 10.0.1.101.63618 > 10.0.1.1.2189: tcp 0
00:43:07.900423 IP 10.0.1.101.63619 > 10.0.1.1.2189: tcp 0
00:43:07.900510 IP 10.0.1.1.2189 > 10.0.1.101.63619: tcp 0
00:43:07.900808 IP 10.0.1.101.63619 > 10.0.1.1.2189: tcp 0
00:43:07.901137 IP 10.0.1.101.63619 > 10.0.1.1.2189: tcp 552
00:43:07.901224 IP 10.0.1.1.2189 > 10.0.1.101.63619: tcp 0
00:43:07.901497 IP 10.0.1.1.2189 > 10.0.1.101.63619: tcp 794
00:43:07.901540 IP 10.0.1.1.2189 > 10.0.1.101.63619: tcp 0
00:43:07.901898 IP 10.0.1.101.63619 > 10.0.1.1.2189: tcp 0
00:43:07.902266 IP 10.0.1.101.63619 > 10.0.1.1.2189: tcp 0
00:43:07.902357 IP 10.0.1.101.63619 > 10.0.1.1.2189: tcp 0
00:43:07.902449 IP 10.0.1.101.63620 > 10.0.1.1.2189: tcp 0
00:43:07.902534 IP 10.0.1.1.2189 > 10.0.1.101.63620: tcp 0
00:43:07.902823 IP 10.0.1.101.63620 > 10.0.1.1.2189: tcp 0
00:43:07.903172 IP 10.0.1.101.63620 > 10.0.1.1.2189: tcp 552
00:43:07.903241 IP 10.0.1.1.2189 > 10.0.1.101.63620: tcp 0
00:43:07.903495 IP 10.0.1.1.2189 > 10.0.1.101.63620: tcp 803
00:43:07.903540 IP 10.0.1.1.2189 > 10.0.1.101.63620: tcp 0
00:43:07.903898 IP 10.0.1.101.63620 > 10.0.1.1.2189: tcp 0
00:43:07.904363 IP 10.0.1.101.63620 > 10.0.1.1.2189: tcp 0
00:43:07.904462 IP 10.0.1.101.63620 > 10.0.1.1.2189: tcp 0
00:43:07.904555 IP 10.0.1.101.63621 > 10.0.1.1.2189: tcp 0
00:43:07.904631 IP 10.0.1.1.2189 > 10.0.1.101.63621: tcp 0
00:43:07.904907 IP 10.0.1.101.63621 > 10.0.1.1.2189: tcp 0
00:43:07.905240 IP 10.0.1.101.63621 > 10.0.1.1.2189: tcp 552
00:43:07.905326 IP 10.0.1.1.2189 > 10.0.1.101.63621: tcp 0
00:43:07.905597 IP 10.0.1.1.2189 > 10.0.1.101.63621: tcp 803
00:43:07.905637 IP 10.0.1.1.2189 > 10.0.1.101.63621: tcp 0
00:43:07.905971 IP 10.0.1.101.63621 > 10.0.1.1.2189: tcp 0
00:43:07.906363 IP 10.0.1.101.63621 > 10.0.1.1.2189: tcp 0
00:43:07.906458 IP 10.0.1.101.63621 > 10.0.1.1.2189: tcp 0
00:43:07.906548 IP 10.0.1.101.63622 > 10.0.1.1.2189: tcp 0
00:43:07.906623 IP 10.0.1.1.2189 > 10.0.1.101.63622: tcp 0
00:43:07.906910 IP 10.0.1.101.63622 > 10.0.1.1.2189: tcp 0
00:43:07.907251 IP 10.0.1.101.63622 > 10.0.1.1.2189: tcp 552
00:43:07.907328 IP 10.0.1.1.2189 > 10.0.1.101.63622: tcp 0
00:43:07.907593 IP 10.0.1.1.2189 > 10.0.1.101.63622: tcp 794
00:43:07.907635 IP 10.0.1.1.2189 > 10.0.1.101.63622: tcp 0
00:43:07.907963 IP 10.0.1.101.63622 > 10.0.1.1.2189: tcp 0
00:43:07.908346 IP 10.0.1.101.63622 > 10.0.1.1.2189: tcp 0
00:43:07.908439 IP 10.0.1.101.63622 > 10.0.1.1.2189: tcp 0
00:43:07.908535 IP 10.0.1.101.63623 > 10.0.1.1.2189: tcp 0
00:43:07.908611 IP 10.0.1.1.2189 > 10.0.1.101.63623: tcp 0
00:43:07.908891 IP 10.0.1.101.63623 > 10.0.1.1.2189: tcp 0
00:43:07.909212 IP 10.0.1.101.63623 > 10.0.1.1.2189: tcp 553
00:43:07.909292 IP 10.0.1.1.2189 > 10.0.1.101.63623: tcp 0
00:43:07.909568 IP 10.0.1.1.2189 > 10.0.1.101.63623: tcp 794
00:43:07.909609 IP 10.0.1.1.2189 > 10.0.1.101.63623: tcp 0
00:43:07.909955 IP 10.0.1.101.63623 > 10.0.1.1.2189: tcp 0
00:43:07.910310 IP 10.0.1.101.63623 > 10.0.1.1.2189: tcp 0
00:43:07.910403 IP 10.0.1.101.63623 > 10.0.1.1.2189: tcp 0
00:43:07.910459 IP 10.0.1.1.2189 > 10.0.1.101.63623: tcp 0
00:43:07.910523 IP 10.0.1.101.63623 > 10.0.1.1.2189: tcp 0
00:43:07.910598 IP 10.0.1.101.63624 > 10.0.1.1.2189: tcp 0
00:43:07.910673 IP 10.0.1.1.2189 > 10.0.1.101.63624: tcp 0
00:43:07.911010 IP 10.0.1.101.63624 > 10.0.1.1.2189: tcp 0
00:43:07.911372 IP 10.0.1.101.63624 > 10.0.1.1.2189: tcp 553
00:43:07.911442 IP 10.0.1.1.2189 > 10.0.1.101.63624: tcp 0
00:43:07.911674 IP 10.0.1.1.2189 > 10.0.1.101.63624: tcp 794
00:43:07.911716 IP 10.0.1.1.2189 > 10.0.1.101.63624: tcp 0
00:43:07.912046 IP 10.0.1.101.63624 > 10.0.1.1.2189: tcp 0
00:43:07.912425 IP 10.0.1.101.63624 > 10.0.1.1.2189: tcp 0
00:43:07.912526 IP 10.0.1.101.63624 > 10.0.1.1.2189: tcp 0
00:43:07.912575 IP 10.0.1.1.2189 > 10.0.1.101.63624: tcp 0
00:43:07.912639 IP 10.0.1.101.63624 > 10.0.1.1.2189: tcp 0
00:43:07.912714 IP 10.0.1.101.63625 > 10.0.1.1.2189: tcp 0
00:43:07.912788 IP 10.0.1.1.2189 > 10.0.1.101.63625: tcp 0
00:43:07.913128 IP 10.0.1.101.63625 > 10.0.1.1.2189: tcp 0
00:43:07.913473 IP 10.0.1.101.63625 > 10.0.1.1.2189: tcp 553
00:43:07.913542 IP 10.0.1.1.2189 > 10.0.1.101.63625: tcp 0
00:43:07.913793 IP 10.0.1.1.2189 > 10.0.1.101.63625: tcp 794
00:43:07.913834 IP 10.0.1.1.2189 > 10.0.1.101.63625: tcp 0
00:43:07.914169 IP 10.0.1.101.63625 > 10.0.1.1.2189: tcp 0
00:43:07.914554 IP 10.0.1.101.63625 > 10.0.1.1.2189: tcp 0
00:43:07.914644 IP 10.0.1.101.63625 > 10.0.1.1.2189: tcp 0
00:43:07.914693 IP 10.0.1.1.2189 > 10.0.1.101.63625: tcp 0
00:43:07.914756 IP 10.0.1.101.63625 > 10.0.1.1.2189: tcp 0
00:43:07.914831 IP 10.0.1.101.63626 > 10.0.1.1.2189: tcp 0
00:43:07.914905 IP 10.0.1.1.2189 > 10.0.1.101.63626: tcp 0
00:43:07.915241 IP 10.0.1.101.63626 > 10.0.1.1.2189: tcp 0
00:43:07.915587 IP 10.0.1.101.63626 > 10.0.1.1.2189: tcp 553
00:43:07.915664 IP 10.0.1.1.2189 > 10.0.1.101.63626: tcp 0
00:43:07.915921 IP 10.0.1.1.2189 > 10.0.1.101.63626: tcp 794
00:43:07.915962 IP 10.0.1.1.2189 > 10.0.1.101.63626: tcp 0
00:43:07.916301 IP 10.0.1.101.63626 > 10.0.1.1.2189: tcp 0
00:43:07.916713 IP 10.0.1.101.63626 > 10.0.1.1.2189: tcp 0
00:43:07.916804 IP 10.0.1.101.63626 > 10.0.1.1.2189: tcp 0
00:43:07.916894 IP 10.0.1.101.63627 > 10.0.1.1.2189: tcp 0
00:43:07.916969 IP 10.0.1.1.2189 > 10.0.1.101.63627: tcp 0
00:43:07.917250 IP 10.0.1.101.63627 > 10.0.1.1.2189: tcp 0
00:43:07.917616 IP 10.0.1.101.63627 > 10.0.1.1.2189: tcp 553
00:43:07.917674 IP 10.0.1.1.2189 > 10.0.1.101.63627: tcp 0
00:43:07.918231 IP 10.0.1.1.2189 > 10.0.1.101.63627: tcp 794
00:43:07.918272 IP 10.0.1.1.2189 > 10.0.1.101.63627: tcp 0
00:43:07.918617 IP 10.0.1.101.63627 > 10.0.1.1.2189: tcp 0
00:43:07.919056 IP 10.0.1.101.63627 > 10.0.1.1.2189: tcp 0
00:43:07.919146 IP 10.0.1.101.63627 > 10.0.1.1.2189: tcp 0
00:43:07.919237 IP 10.0.1.101.63628 > 10.0.1.1.2189: tcp 0
00:43:07.919313 IP 10.0.1.1.2189 > 10.0.1.101.63628: tcp 0
00:43:07.919596 IP 10.0.1.101.63628 > 10.0.1.1.2189: tcp 0
00:43:07.919943 IP 10.0.1.101.63628 > 10.0.1.1.2189: tcp 553
00:43:07.920011 IP 10.0.1.1.2189 > 10.0.1.101.63628: tcp 0
00:43:07.920252 IP 10.0.1.1.2189 > 10.0.1.101.63628: tcp 794
00:43:07.920293 IP 10.0.1.1.2189 > 10.0.1.101.63628: tcp 0
00:43:07.920644 IP 10.0.1.101.63628 > 10.0.1.1.2189: tcp 0
00:43:07.921047 IP 10.0.1.101.63628 > 10.0.1.1.2189: tcp 0
00:43:07.921138 IP 10.0.1.101.63628 > 10.0.1.1.2189: tcp 0
00:43:07.921187 IP 10.0.1.1.2189 > 10.0.1.101.63628: tcp 0
00:43:07.921251 IP 10.0.1.101.63628 > 10.0.1.1.2189: tcp 0
00:43:07.921326 IP 10.0.1.101.63629 > 10.0.1.1.2189: tcp 0
00:43:07.921401 IP 10.0.1.1.2189 > 10.0.1.101.63629: tcp 0
00:43:07.921755 IP 10.0.1.101.63629 > 10.0.1.1.2189: tcp 0
00:43:07.922081 IP 10.0.1.101.63629 > 10.0.1.1.2189: tcp 553
00:43:07.922158 IP 10.0.1.1.2189 > 10.0.1.101.63629: tcp 0
00:43:07.922428 IP 10.0.1.1.2189 > 10.0.1.101.63629: tcp 794
00:43:07.922476 IP 10.0.1.1.2189 > 10.0.1.101.63629: tcp 0
00:43:07.922816 IP 10.0.1.101.63629 > 10.0.1.1.2189: tcp 0
00:43:07.923197 IP 10.0.1.101.63629 > 10.0.1.1.2189: tcp 0
00:43:07.923289 IP 10.0.1.101.63629 > 10.0.1.1.2189: tcp 0
00:43:07.923337 IP 10.0.1.1.2189 > 10.0.1.101.63629: tcp 0
00:43:07.923401 IP 10.0.1.101.63629 > 10.0.1.1.2189: tcp 0
00:43:07.923485 IP 10.0.1.101.63630 > 10.0.1.1.2189: tcp 0
00:43:07.923558 IP 10.0.1.1.2189 > 10.0.1.101.63630: tcp 0
00:43:07.923898 IP 10.0.1.101.63630 > 10.0.1.1.2189: tcp 0
00:43:07.924219 IP 10.0.1.101.63630 > 10.0.1.1.2189: tcp 553
00:43:07.924285 IP 10.0.1.1.2189 > 10.0.1.101.63630: tcp 0
00:43:07.924565 IP 10.0.1.1.2189 > 10.0.1.101.63630: tcp 794
00:43:07.924607 IP 10.0.1.1.2189 > 10.0.1.101.63630: tcp 0
00:43:07.924938 IP 10.0.1.101.63630 > 10.0.1.1.2189: tcp 0
00:43:07.925302 IP 10.0.1.101.63630 > 10.0.1.1.2189: tcp 0
00:43:07.925392 IP 10.0.1.101.63630 > 10.0.1.1.2189: tcp 0
00:43:07.925441 IP 10.0.1.1.2189 > 10.0.1.101.63630: tcp 0
00:43:07.925514 IP 10.0.1.101.63630 > 10.0.1.1.2189: tcp 0
00:43:07.925589 IP 10.0.1.101.63631 > 10.0.1.1.2189: tcp 0
00:43:07.925664 IP 10.0.1.1.2189 > 10.0.1.101.63631: tcp 0
00:43:07.926003 IP 10.0.1.101.63631 > 10.0.1.1.2189: tcp 0
00:43:07.926327 IP 10.0.1.101.63631 > 10.0.1.1.2189: tcp 553
00:43:07.926412 IP 10.0.1.1.2189 > 10.0.1.101.63631: tcp 0
00:43:07.926692 IP 10.0.1.1.2189 > 10.0.1.101.63631: tcp 794
00:43:07.926736 IP 10.0.1.1.2189 > 10.0.1.101.63631: tcp 0
00:43:07.927067 IP 10.0.1.101.63631 > 10.0.1.1.2189: tcp 0
00:43:07.927436 IP 10.0.1.101.63631 > 10.0.1.1.2189: tcp 0
00:43:07.927537 IP 10.0.1.101.63631 > 10.0.1.1.2189: tcp 0
00:43:07.927585 IP 10.0.1.1.2189 > 10.0.1.101.63631: tcp 0
00:43:07.927649 IP 10.0.1.101.63631 > 10.0.1.1.2189: tcp 0
00:43:07.927723 IP 10.0.1.101.63632 > 10.0.1.1.2189: tcp 0
00:43:07.927797 IP 10.0.1.1.2189 > 10.0.1.101.63632: tcp 0
00:43:07.928136 IP 10.0.1.101.63632 > 10.0.1.1.2189: tcp 0
00:43:07.928477 IP 10.0.1.101.63632 > 10.0.1.1.2189: tcp 553
00:43:07.928552 IP 10.0.1.1.2189 > 10.0.1.101.63632: tcp 0
00:43:07.928862 IP 10.0.1.1.2189 > 10.0.1.101.63632: tcp 794
00:43:07.928902 IP 10.0.1.1.2189 > 10.0.1.101.63632: tcp 0
00:43:07.929274 IP 10.0.1.101.63632 > 10.0.1.1.2189: tcp 0
00:43:07.929632 IP 10.0.1.101.63632 > 10.0.1.1.2189: tcp 0
00:43:07.929727 IP 10.0.1.101.63632 > 10.0.1.1.2189: tcp 0
00:43:07.929817 IP 10.0.1.101.63633 > 10.0.1.1.2189: tcp 0
00:43:07.929895 IP 10.0.1.1.2189 > 10.0.1.101.63633: tcp 0
00:43:07.930178 IP 10.0.1.101.63633 > 10.0.1.1.2189: tcp 0
00:43:07.930496 IP 10.0.1.101.63633 > 10.0.1.1.2189: tcp 553
00:43:07.930567 IP 10.0.1.1.2189 > 10.0.1.101.63633: tcp 0
00:43:07.930844 IP 10.0.1.1.2189 > 10.0.1.101.63633: tcp 794
00:43:07.930885 IP 10.0.1.1.2189 > 10.0.1.101.63633: tcp 0
00:43:07.931224 IP 10.0.1.101.63633 > 10.0.1.1.2189: tcp 0
00:43:07.931601 IP 10.0.1.101.63633 > 10.0.1.1.2189: tcp 0
00:43:07.931691 IP 10.0.1.101.63633 > 10.0.1.1.2189: tcp 0
00:43:07.931739 IP 10.0.1.1.2189 > 10.0.1.101.63633: tcp 0
00:43:07.931803 IP 10.0.1.101.63633 > 10.0.1.1.2189: tcp 0
00:43:07.931877 IP 10.0.1.101.63634 > 10.0.1.1.2189: tcp 0
00:43:07.931951 IP 10.0.1.1.2189 > 10.0.1.101.63634: tcp 0
00:43:07.932287 IP 10.0.1.101.63634 > 10.0.1.1.2189: tcp 0
00:43:07.932670 IP 10.0.1.101.63634 > 10.0.1.1.2189: tcp 553
00:43:07.932738 IP 10.0.1.1.2189 > 10.0.1.101.63634: tcp 0
00:43:07.932975 IP 10.0.1.1.2189 > 10.0.1.101.63634: tcp 794
00:43:07.933016 IP 10.0.1.1.2189 > 10.0.1.101.63634: tcp 0
00:43:07.933347 IP 10.0.1.101.63634 > 10.0.1.1.2189: tcp 0
00:43:07.933813 IP 10.0.1.101.63634 > 10.0.1.1.2189: tcp 0
00:43:07.933905 IP 10.0.1.101.63634 > 10.0.1.1.2189: tcp 0
00:43:07.933954 IP 10.0.1.1.2189 > 10.0.1.101.63634: tcp 0
00:43:07.934017 IP 10.0.1.101.63634 > 10.0.1.1.2189: tcp 0
00:43:07.934091 IP 10.0.1.101.63635 > 10.0.1.1.2189: tcp 0
00:43:07.934166 IP 10.0.1.1.2189 > 10.0.1.101.63635: tcp 0
00:43:07.934522 IP 10.0.1.101.63635 > 10.0.1.1.2189: tcp 0
00:43:07.934853 IP 10.0.1.101.63635 > 10.0.1.1.2189: tcp 553
00:43:07.934936 IP 10.0.1.1.2189 > 10.0.1.101.63635: tcp 0
00:43:07.935204 IP 10.0.1.1.2189 > 10.0.1.101.63635: tcp 794
00:43:07.935247 IP 10.0.1.1.2189 > 10.0.1.101.63635: tcp 0
00:43:07.935588 IP 10.0.1.101.63635 > 10.0.1.1.2189: tcp 0
00:43:07.935951 IP 10.0.1.101.63635 > 10.0.1.1.2189: tcp 0
00:43:07.936042 IP 10.0.1.101.63635 > 10.0.1.1.2189: tcp 0
00:43:07.936091 IP 10.0.1.1.2189 > 10.0.1.101.63635: tcp 0
00:43:07.936154 IP 10.0.1.101.63635 > 10.0.1.1.2189: tcp 0
00:43:07.936229 IP 10.0.1.101.63636 > 10.0.1.1.2189: tcp 0
00:43:07.936303 IP 10.0.1.1.2189 > 10.0.1.101.63636: tcp 0
00:43:07.936655 IP 10.0.1.101.63636 > 10.0.1.1.2189: tcp 0
00:43:07.937000 IP 10.0.1.101.63636 > 10.0.1.1.2189: tcp 553
00:43:07.937079 IP 10.0.1.1.2189 > 10.0.1.101.63636: tcp 0
00:43:07.937327 IP 10.0.1.1.2189 > 10.0.1.101.63636: tcp 794
00:43:07.937367 IP 10.0.1.1.2189 > 10.0.1.101.63636: tcp 0
00:43:07.937698 IP 10.0.1.101.63636 > 10.0.1.1.2189: tcp 0
00:43:07.938077 IP 10.0.1.101.63636 > 10.0.1.1.2189: tcp 0
00:43:07.938166 IP 10.0.1.101.63636 > 10.0.1.1.2189: tcp 0
00:43:07.938257 IP 10.0.1.101.63637 > 10.0.1.1.2189: tcp 0
00:43:07.938332 IP 10.0.1.1.2189 > 10.0.1.101.63637: tcp 0
00:43:07.938617 IP 10.0.1.101.63637 > 10.0.1.1.2189: tcp 0
00:43:07.938926 IP 10.0.1.101.63637 > 10.0.1.1.2189: tcp 553
00:43:07.938984 IP 10.0.1.1.2189 > 10.0.1.101.63637: tcp 0
00:43:07.939249 IP 10.0.1.1.2189 > 10.0.1.101.63637: tcp 794
00:43:07.939293 IP 10.0.1.1.2189 > 10.0.1.101.63637: tcp 0
00:43:07.939629 IP 10.0.1.101.63637 > 10.0.1.1.2189: tcp 0
00:43:07.939990 IP 10.0.1.101.63637 > 10.0.1.1.2189: tcp 0
00:43:07.940079 IP 10.0.1.101.63637 > 10.0.1.1.2189: tcp 0
00:43:07.940128 IP 10.0.1.1.2189 > 10.0.1.101.63637: tcp 0
00:43:07.940199 IP 10.0.1.101.63637 > 10.0.1.1.2189: tcp 0
00:43:07.940273 IP 10.0.1.101.63638 > 10.0.1.1.2189: tcp 0
00:43:07.940349 IP 10.0.1.1.2189 > 10.0.1.101.63638: tcp 0
00:43:07.940703 IP 10.0.1.101.63638 > 10.0.1.1.2189: tcp 0
00:43:07.941022 IP 10.0.1.101.63638 > 10.0.1.1.2189: tcp 553
00:43:07.941106 IP 10.0.1.1.2189 > 10.0.1.101.63638: tcp 0
00:43:07.941343 IP 10.0.1.1.2189 > 10.0.1.101.63638: tcp 587
00:43:07.941386 IP 10.0.1.1.2189 > 10.0.1.101.63638: tcp 0
00:43:07.941732 IP 10.0.1.101.63638 > 10.0.1.1.2189: tcp 0
00:43:07.942093 IP 10.0.1.101.63638 > 10.0.1.1.2189: tcp 0
00:43:07.942184 IP 10.0.1.101.63638 > 10.0.1.1.2189: tcp 0
00:43:07.942233 IP 10.0.1.1.2189 > 10.0.1.101.63638: tcp 0
00:43:07.942296 IP 10.0.1.101.63638 > 10.0.1.1.2189: tcp 0
00:43:07.942370 IP 10.0.1.101.63639 > 10.0.1.1.2189: tcp 0
00:43:07.942445 IP 10.0.1.1.2189 > 10.0.1.101.63639: tcp 0
00:43:07.942789 IP 10.0.1.101.63639 > 10.0.1.1.2189: tcp 0
00:43:07.943107 IP 10.0.1.101.63639 > 10.0.1.1.2189: tcp 490
00:43:07.943172 IP 10.0.1.1.2189 > 10.0.1.101.63639: tcp 0
00:43:07.943461 IP 10.0.1.1.2189 > 10.0.1.101.63639: tcp 517
00:43:07.943503 IP 10.0.1.1.2189 > 10.0.1.101.63639: tcp 0
00:43:07.943826 IP 10.0.1.101.63639 > 10.0.1.1.2189: tcp 0
00:43:07.944190 IP 10.0.1.101.63639 > 10.0.1.1.2189: tcp 0
00:43:07.944283 IP 10.0.1.101.63639 > 10.0.1.1.2189: tcp 0
00:43:08.130543 IP 10.0.1.1.12434 > 239.255.255.250.1900: UDP, length 462
00:43:08.130603 IP 10.0.1.1.12434 > 239.255.255.250.1900: UDP, length 462
00:43:08.130627 IP 10.0.1.1.12434 > 239.255.255.250.1900: UDP, length 478
00:43:08.130651 IP 10.0.1.1.12434 > 239.255.255.250.1900: UDP, length 460
00:43:08.130674 IP 10.0.1.1.12434 > 239.255.255.250.1900: UDP, length 406
00:43:08.130698 IP 10.0.1.1.12434 > 239.255.255.250.1900: UDP, length 446
00:43:08.130721 IP 10.0.1.1.12434 > 239.255.255.250.1900: UDP, length 406
00:43:08.130745 IP 10.0.1.1.12434 > 239.255.255.250.1900: UDP, length 466
00:43:08.130768 IP 10.0.1.1.12434 > 239.255.255.250.1900: UDP, length 406
00:43:08.130792 IP 10.0.1.1.12434 > 239.255.255.250.1900: UDP, length 470
00:43:08.130816 IP 10.0.1.1.12434 > 239.255.255.250.1900: UDP, length 398
```

3. Upon game bootup (uTorrent is closed) and no part is mapped:

```
00:45:07.838720 IP 10.0.1.1.12434 > 239.255.255.250.1900: UDP, length 398
00:45:07.838817 IP 10.0.1.1.12434 > 239.255.255.250.1900: UDP, length 470
00:45:07.838867 IP 10.0.1.1.12434 > 239.255.255.250.1900: UDP, length 406
00:45:07.838915 IP 10.0.1.1.12434 > 239.255.255.250.1900: UDP, length 466
00:45:07.838960 IP 10.0.1.1.12434 > 239.255.255.250.1900: UDP, length 406
00:45:07.839005 IP 10.0.1.1.12434 > 239.255.255.250.1900: UDP, length 446
00:45:07.839052 IP 10.0.1.1.12434 > 239.255.255.250.1900: UDP, length 406
00:45:07.839153 IP 10.0.1.1.12434 > 239.255.255.250.1900: UDP, length 460
00:45:07.839234 IP 10.0.1.1.12434 > 239.255.255.250.1900: UDP, length 478
00:45:07.839313 IP 10.0.1.1.12434 > 239.255.255.250.1900: UDP, length 462
00:45:07.839389 IP 10.0.1.1.12434 > 239.255.255.250.1900: UDP, length 462
00:45:08.091500 IP 10.0.1.1.12434 > 239.255.255.250.1900: UDP, length 462
00:45:08.091555 IP 10.0.1.1.12434 > 239.255.255.250.1900: UDP, length 462
00:45:08.091579 IP 10.0.1.1.12434 > 239.255.255.250.1900: UDP, length 478
00:45:08.091603 IP 10.0.1.1.12434 > 239.255.255.250.1900: UDP, length 460
00:45:08.091630 IP 10.0.1.1.12434 > 239.255.255.250.1900: UDP, length 406
00:45:08.091658 IP 10.0.1.1.12434 > 239.255.255.250.1900: UDP, length 446
00:45:08.091681 IP 10.0.1.1.12434 > 239.255.255.250.1900: UDP, length 406
00:45:08.091708 IP 10.0.1.1.12434 > 239.255.255.250.1900: UDP, length 466
00:45:08.091732 IP 10.0.1.1.12434 > 239.255.255.250.1900: UDP, length 406
00:45:08.091759 IP 10.0.1.1.12434 > 239.255.255.250.1900: UDP, length 470
00:45:08.091783 IP 10.0.1.1.12434 > 239.255.255.250.1900: UDP, length 398
00:45:37.916973 IP 10.0.1.1.12434 > 239.255.255.250.1900: UDP, length 398
00:45:37.917035 IP 10.0.1.1.12434 > 239.255.255.250.1900: UDP, length 470
00:45:37.917082 IP 10.0.1.1.12434 > 239.255.255.250.1900: UDP, length 406
00:45:37.917132 IP 10.0.1.1.12434 > 239.255.255.250.1900: UDP, length 466
00:45:37.917176 IP 10.0.1.1.12434 > 239.255.255.250.1900: UDP, length 406
00:45:37.917224 IP 10.0.1.1.12434 > 239.255.255.250.1900: UDP, length 446
00:45:37.917267 IP 10.0.1.1.12434 > 239.255.255.250.1900: UDP, length 406
00:45:37.917314 IP 10.0.1.1.12434 > 239.255.255.250.1900: UDP, length 460
00:45:37.917360 IP 10.0.1.1.12434 > 239.255.255.250.1900: UDP, length 478
00:45:37.917405 IP 10.0.1.1.12434 > 239.255.255.250.1900: UDP, length 462
00:45:37.917463 IP 10.0.1.1.12434 > 239.255.255.250.1900: UDP, length 462
00:45:38.169545 IP 10.0.1.1.12434 > 239.255.255.250.1900: UDP, length 462
00:45:38.169592 IP 10.0.1.1.12434 > 239.255.255.250.1900: UDP, length 462
00:45:38.169617 IP 10.0.1.1.12434 > 239.255.255.250.1900: UDP, length 478
00:45:38.169641 IP 10.0.1.1.12434 > 239.255.255.250.1900: UDP, length 460
00:45:38.169664 IP 10.0.1.1.12434 > 239.255.255.250.1900: UDP, length 406
00:45:38.169687 IP 10.0.1.1.12434 > 239.255.255.250.1900: UDP, length 446
00:45:38.169712 IP 10.0.1.1.12434 > 239.255.255.250.1900: UDP, length 406
00:45:38.169756 IP 10.0.1.1.12434 > 239.255.255.250.1900: UDP, length 466
00:45:38.169786 IP 10.0.1.1.12434 > 239.255.255.250.1900: UDP, length 406
00:45:38.169829 IP 10.0.1.1.12434 > 239.255.255.250.1900: UDP, length 470
00:45:38.169861 IP 10.0.1.1.12434 > 239.255.255.250.1900: UDP, length 398
```

**Comment by kevindd992002** [comment]
I used your upnp test client and here's what I get:

1. Without VPN:

```
C:\Users\Charmaine\Downloads\upnpc-exe-win32-20150918>upnpc-static.exe -s
upnpc : miniupnpc library test client, version 1.9.
 (c) 2005-2014 Thomas Bernard.
Go to http://miniupnp.free.fr/ or http://miniupnp.tuxfamily.org/
for more information.
List of UPNP devices found on the network :
 desc: http://192.168.10.1:2189/rootDesc.xml
 st: urn:schemas-upnp-org:device:InternetGatewayDevice:1

Found valid IGD : http://192.168.10.1:2189/ctl/IPConn
Local LAN ip address : 192.168.10.13
Connection Type : IP_Routed
Status : Connected, uptime=2849s, LastConnectionError : ERROR_NONE
  Time started : Mon May 11 00:14:37 2020
MaxBitRateDown : 1000000000 bps (1000.0 Mbps)   MaxBitRateUp 1000000000 bps (1000.0 Mbps)
ExternalIPAddress = <external IP>
Bytes:   Sent: 4294967295       Recv: 4294967295
Packets: Sent: 196066002        Recv: 271654995
```

2. With VPN:

```
C:\Users\Charmaine\Downloads\upnpc-exe-win32-20150918>upnpc-static.exe -s
upnpc : miniupnpc library test client, version 1.9.
 (c) 2005-2014 Thomas Bernard.
Go to http://miniupnp.free.fr/ or http://miniupnp.tuxfamily.org/
for more information.
No IGD UPnP Device found on the network !
```

**Comment by miniupnp** [comment]
your log are unreadable. please filter out non SSDP packets.

What can I see is that 10.0.1.1 broadcast multicast SSDP packets. Should be NOTIFY, but your log don't show, below it what is should be : 
```
  113 2023.460246541 192.168.10.254 → 239.255.255.250 SSDP 314 NOTIFY * HTTP/1.1 
  114 2023.460268365 192.168.10.254 → 239.255.255.250 SSDP 326 NOTIFY * HTTP/1.1 
  115 2023.460627505 192.168.10.254 → 239.255.255.250 SSDP 386 NOTIFY * HTTP/1.1 
  116 2023.460638862 192.168.10.254 → 239.255.255.250 SSDP 378 NOTIFY * HTTP/1.1 
  117 2023.460843139 192.168.10.254 → 239.255.255.250 SSDP 326 NOTIFY * HTTP/1.1 
  118 2023.461004627 192.168.10.254 → 239.255.255.250 SSDP 362 NOTIFY * HTTP/1.1 
  119 2023.461009075 192.168.10.254 → 239.255.255.250 SSDP 394 NOTIFY * HTTP/1.1 
  120 2023.461281724 192.168.10.254 → 239.255.255.250 SSDP 328 NOTIFY * HTTP/1.1 
  121 2023.461293015 192.168.10.254 → 239.255.255.250 SSDP 383 NOTIFY * HTTP/1.1 
  122 2023.461528116 192.168.10.254 → 239.255.255.250 SSDP 377 NOTIFY * HTTP/1.1 
```
Should be every 30 secs or so.

But I can't see any M-SEARCH packet from 10.0.1.101

You need to ensure that th OpenVPN client and server handle Multicast

**Comment by miniupnp** [comment]
Also I don't see any proof of utorrent using either UPnP IGD or NAT-PMP to add the portmapping.

**Comment by kevindd992002** [comment]
I don't understand. It's obvious in the uTorrent packet capture that it is using port 2189 to communicate with the upnp server in pfsense. Tcp 2189 is used by your daemon, right? Also, the Status -> Upnp & NAT-PMP page in pfsense shows the correct mapping with uTorrent. I've tried this a million times, changing ports in uTorrent, and it always gets mapped correctly. I can even do a telnet test from an external source to that port and it forwards properly to uTorrent.

**Comment by kevindd992002** [comment]
If uTorrent works, then that means multicast is being handled correctly by the openvpn client and server, no?

**Comment by miniupnp** [comment]
> If uTorrent works, then that means multicast is being handled correctly by the openvpn client and server, no?

Well you captured no Multicast packet from your openVPN client to the server.
It may work only from the server to the client, utorrent may have received the NOTIFY packets.

anyway, I don't see any miniupnpd issue here, please check your network configuration. It may well be a firewall issue on the "client" side.

**Comment by kevindd992002** [comment]
Ok, I'll check and post back with a wireshark capture from the client. Question though, where is TCP 2189 used in the whole upnp process?

**Comment by kevindd992002** [comment]
Ok, it looks like you're right. I do see M-SEARCH packets from the client but I don't see them reaching the openvpn interface in pfsense. So uTorrent is intelligent enough to use port 2189 non-multicast packets instead?

**Comment by miniupnp** [comment]
I don't have the time to explain here the details of the parts of the UPnP protocols.
http://upnp.org/specs/arch/UPnP-arch-DeviceArchitecture-v1.1.pdf
Have a looks at "1. Discovery"

plain HTTP (over TCP) is used for Description, Control (and Eventing)

**Comment by kevindd992002** [comment]
@miniupnp, if it's not too much of a hassle for you, would you mind checking out my netgate thread [here](https://forum.netgate.com/topic/153442/how-to-make-multicast-work-within-the-openvpn-tunnel-network)? If you read through the thread, I believe I've explained the issue well enough where SSDP multicast M-SEARCH method packets are being generated by the client but not reaching the openvpn server interface (gateway) for some reason but maybe you can explain the issue better? Thanks.

**Comment by miniupnp** [comment]
well nobody can help you without the OpenVPN configurations

**Comment by kevindd992002** [comment]
Yeah, I figured. I just replied there and posted my OpenVPN remote access server configurations. For reference, here they are:

https://forum.netgate.com/post/911141

**Comment by miniupnp** [comment]
still no details on your OpenVPN client and if it properly route multicast (that is probably the issue)

**Comment by kevindd992002** [comment]
client config:

```
dev tun
persist-tun
persist-key
cipher AES-128-GCM
ncp-disable
auth SHA256
tls-client
client
resolv-retry infinite
remote homeprovince.ddns.net 1195 udp4
setenv opt block-outside-dns
lport 0
verify-x509-name "homeprovince.ddns.net" name
auth-user-pass
pkcs12 pfSense-UDP4-1195-kevindd992002.p12
tls-auth pfSense-UDP4-1195-kevindd992002-tls.key 1
remote-cert-tls server
compress 
```

I used the client export package in pfsense to export the client install file with those config. Routing table goes something like this:

![image](https://user-images.githubusercontent.com/3907957/81622084-ab2eee80-9422-11ea-8855-6f70afcf5c8c.png)

**Comment by miniupnp** [comment]
Make sure your OS (you don't tell which one you use) is set up to allow multicast traffic to go to the OpenVPN LAN. Check :
1. OpenVPN client - You don't tell which version you are using.
2. routing table
3. Firewall

(multicast addresses are 232.0.0.0/8)

**Comment by miniupnp** [comment]
https://lmgtfy.com/?q=windows+multicast+to+openvpn

**Comment by kevindd992002** [comment]
I'm using Windows 10 x64 1909.

1. OpenVPN 2.4.9
2. I posted the routing table above. You can see all traffic (except if destination is the LAN, of course) will route through the OpenVPN server interface (10.0.1.1). More importantly, you see there that the the winning multicast group route is that of the OpenVPN gateway because of the lowest metric of 259). So all good there.
3. Client firewall does not block outbound connections. Both LAN and OpenVPN adapaters are set to Private network too. Pfsense OpenVPN interface allows IPv4 10.0.1.101 (client IP) to any. So no firewall issues there too.

**Comment by miniupnp** [comment]
https://forums.openvpn.net/viewtopic.php?t=8036 this post says OpenVPN has trouble with multicast when using "tun" interfaces.

Have you tried using the "-m" command line option of `upnpc-static.exe` to force the right network interface ?
I'm not sure the right one is picked

**Comment by miniupnp** [comment]
by the way, it really looks like a OpenVPN issue, not a miniupnp issue, so please report the issue on the right place

**Comment by kevindd992002** [comment]
Yes, I read that post too. But I was wondering if you can use a tap interface without bridging (because bridging sucks).

Yes, I tried the -m switch too. And even without it, I'm sure that it is going out the OpenVPN interface. The packet capture logs says it all.

I know it's not a miniupnp issue. I just posted again here asking for your help if you can post in that netgate thread that I posted above to backup my claim that the multicast traffic from the client -> server is the issue.
