### ISSUE TITLE
miniupnpc unable to find MikroTik Router as UPnP Device

### ISSUE THREAD

**Issue by daryll-swer** [miniupnp/miniupnp#535]
Basically, I have a MikroTik Edge Router which has a public IP and NATted, in front of it is a TP-Link AP (in AP mode, bridged), which is where the WireGuard Pi is connected to.

MikroTik is 192.168.1.1/24
AP is bridged and is 192.168.1.2 (AP mode+bridged meaning UPnP is disabled on this TP-Link)
Pi is 192.168.1.9

So when running upnpc, it ends up detecting the UPnP feature on the TP-Link with its IP address (192.168.1.2) and "URL" instead of the MikroTik.

Is there a way to fix this? -u wouldn't work as my edge router is RouterOS. There does not seem to be an XML URL for that.

**Comment by miniupnp** [comment]
what is the output of `listdevices` ?

**Comment by daryll-swer** [comment]
> `listdevices`

`pi@raspberrypi:~ $ upnpc -listdevices
upnpc : miniupnpc library test client, version 2.1.
 (c) 2005-2018 Thomas Bernard.
Go to http://miniupnp.free.fr/ or https://miniupnp.tuxfamily.org/
for more information.
List of UPNP devices found on the network :
 desc: http://192.168.88.2:49152/description.xml
 st: upnp:rootdevice

UPnP device found. Is it an IGD ? : http://192.168.88.2:49152/
Trying to continue anyway
Local LAN ip address : unset
GetConnectionTypeInfo failed.
GetStatusInfo failed.
GetLinkLayerMaxBitRates failed.
GetExternalIPAddress failed. (errorcode=-3)
 i protocol exPort->inAddr:inPort description remoteHost leaseTime
GetGenericPortMappingEntry() returned -3 (UnknownError)`

**Comment by Anuskuss** [comment]
What's the device behind `192.168.88.2`? And have you tried `-u http://192.168.88.2:49152/description.xml`?

**Comment by daryll-swer** [comment]
> What's the device behind `192.168.88.2`?
I already mentioned the details on the OP

> MikroTik is 192.168.1.1/24
> AP is bridged and is 192.168.1.2 (AP mode+bridged meaning UPnP is disabled on this TP-Link)
> Pi is 192.168.1.9

> And have you tried `-u http://192.168.88.2:49152/description.xml`?
No, because that is not my router.

**Comment by Anuskuss** [comment]
> No, because that is not my router.

Okay, but have you tried that path on your router? You could also look online for either your router's manual or just "TP-Link UPnP XML" and try out a bunch of paths. For example mine is called `/IGDdevicedesc_brlan0.xml`.

**Comment by daryll-swer** [comment]
> > No, because that is not my router.
> 
> Okay, but have you tried that path on your router? You could also look online for either your router's manual or just "TP-Link UPnP XML" and try out a bunch of paths. For example mine is called `/IGDdevicedesc_brlan0.xml`.

Did you read OP? I keep telling you my router is a **MikroTik**, **not** TP-Link. MikroTik does not have paths mentioned anywhere on their docs.

**Comment by miniupnp** [comment]
> > `listdevices`
> 
> ```
> pi@raspberrypi:~ $ upnpc -listdevices
> upnpc : miniupnpc library test client, version 2.1.
>  (c) 2005-2018 Thomas Bernard.
> Go to http://miniupnp.free.fr/ or https://miniupnp.tuxfamily.org/
> for more information.
> List of UPNP devices found on the network :
>  desc: http://192.168.88.2:49152/description.xml
>  st: upnp:rootdevice
> 
> UPnP device found. Is it an IGD ? : http://192.168.1.2:49152/
> Trying to continue anyway
> Local LAN ip address : unset
> GetConnectionTypeInfo failed.
> GetStatusInfo failed.
> GetLinkLayerMaxBitRates failed.
> GetExternalIPAddress failed. (errorcode=-3)
>  i protocol exPort->inAddr:inPort description remoteHost leaseTime
> GetGenericPortMappingEntry() returned -3 (UnknownError)
> ```

your Pi is probably not on the same sub-net as your MikroTik router. So the router never receive the SSDP M-SEARCH requests and cannot answer them !

the router is on the subnet 192.168.1.0/24, your Pi is likely not on the same one, because it wouldn't detect any device with the address 192.168.88.2 then !

What's the IP of your Pi machine ?

**Comment by miniupnp** [comment]
If your machine has several network interface, use -m option to select one (`upnpc -m eth1`)

**Comment by daryll-swer** [comment]
> > > `listdevices`
> > 
> > 
> > ```
> > pi@raspberrypi:~ $ upnpc -listdevices
> > upnpc : miniupnpc library test client, version 2.1.
> >  (c) 2005-2018 Thomas Bernard.
> > Go to http://miniupnp.free.fr/ or https://miniupnp.tuxfamily.org/
> > for more information.
> > List of UPNP devices found on the network :
> >  desc: http://192.168.88.2:49152/description.xml
> >  st: upnp:rootdevice
> > 
> > UPnP device found. Is it an IGD ? : http://192.168.1.2:49152/
> > Trying to continue anyway
> > Local LAN ip address : unset
> > GetConnectionTypeInfo failed.
> > GetStatusInfo failed.
> > GetLinkLayerMaxBitRates failed.
> > GetExternalIPAddress failed. (errorcode=-3)
> >  i protocol exPort->inAddr:inPort description remoteHost leaseTime
> > GetGenericPortMappingEntry() returned -3 (UnknownError)
> > ```
> 
> your Pi is probably not on the same sub-net as your MikroTik router. So the router never receive the SSDP M-SEARCH requests and cannot answer them !
> 
> the router is on the subnet 192.168.1.0/24, your Pi is likely not on the same one, because it wouldn't detect any device with the address 192.168.88.2 then !
> 
> What's the IP(s) of your Pi machine ?

Ah sorry about that wrong subnet typo (The reason for .88 is that's my actual subnet which is used, but substituted with .1 for simplicity here in this thread).

Router is 192.168.1.1
AP is 192.168.1.2
Pi is 192.168.1.9, it has only eth0 as network interface.

**Comment by miniupnp** [comment]
you should use tcpdump / tshark / etc. to see if the SSDP M-SEARCH packet is sent.
```
$ sudo tcpdump -n -A "port 1900"
tcpdump: verbose output suppressed, use -v or -vv for full protocol decode
listening on em0, link-type EN10MB (Ethernet), capture size 262144 bytes
10:45:11.751729 IP 192.168.11.149.61000 > 239.255.255.250.1900: UDP, length 137
E....8...............H.l....M-SEARCH * HTTP/1.1
HOST: 239.255.255.250:1900
ST: urn:schemas-upnp-org:device:InternetGatewayDevice:1
MAN: "ssdp:discover"
MX: 2


10:45:11.752794 IP 192.168.11.254.1900 > 192.168.11.149.61000: UDP, length 303
E..K.q@.@..M.........l.H.7>.HTTP/1.1 200 OK
SERVER: Linux/2.6 UPnP/1.0 fbxigdd/1.1
LOCATION: http://192.168.11.254:5678/desc/root
EXT:
CACHE-CONTROL: max-age=1800
ST: urn:schemas-upnp-org:device:InternetGatewayDevice:1
USN: uuid:igd73616d61-6a65-7374-650a-0024d4a5d636::urn:schemas-upnp-org:device:InternetGatewayDevice:1



```

The M-SEARCH should be received by every host on the network. If it isn't something is filtering ...

**Comment by daryll-swer** [comment]
> you should use tcpdump / tshark / etc. to see if the SSDP M-SEARCH packet is sent.
> 
> ```
> $ sudo tcpdump -n -A "port 1900"

Below is the output

```tcpdump: verbose output suppressed, use -v or -vv for full protocol decode
listening on eth0, link-type EN10MB (Ethernet), capture size 262144 bytes
16:18:07.451580 IP 192.168.88.2.43088 > 239.255.255.250.1900: UDP, length 327
E..c..@...l...X......P.l.O..NOTIFY * HTTP/1.1
HOST: 239.255.255.250:1900
CACHE-CONTROL: max-age=100
LOCATION: http://192.168.88.2:49153/description.xml
NT: upnp:rootdevice
NTS: ssdp:alive
SERVER: Linux/3.10.14, UPnP/1.0, Portable SDK for UPnP devices/1.3.1
X-User-Agent: redsonic
USN: uuid:00000000-0000-1000-0000-D847328BFC10::upnp:rootdevice


16:18:07.558954 IP 192.168.88.2.43088 > 239.255.255.250.1900: UDP, length 327
E..c..@...l...X......P.l.O..NOTIFY * HTTP/1.1
HOST: 239.255.255.250:1900
CACHE-CONTROL: max-age=100
LOCATION: http://192.168.88.2:49153/description.xml
NT: upnp:rootdevice
NTS: ssdp:alive
SERVER: Linux/3.10.14, UPnP/1.0, Portable SDK for UPnP devices/1.3.1
X-User-Agent: redsonic
USN: uuid:00000000-0000-1000-0000-D847328BFC10::upnp:rootdevice


16:18:07.666937 IP 192.168.88.2.43088 > 239.255.255.250.1900: UDP, length 336
E..l..@...l...X......P.l.X.fNOTIFY * HTTP/1.1
HOST: 239.255.255.250:1900
CACHE-CONTROL: max-age=100
LOCATION: http://192.168.88.2:49153/description.xml
NT: uuid:00000000-0000-1000-0000-D847328BFC10
NTS: ssdp:alive
SERVER: Linux/3.10.14, UPnP/1.0, Portable SDK for UPnP devices/1.3.1
X-User-Agent: redsonic
USN: uuid:00000000-0000-1000-0000-D847328BFC10```

>The M-SEARCH should be received by every host on the network. If it isn't something is filtering ...

My router (192.168.1.1) does not filter LAN to LAN traffic and multicast traffic between LAN is allowed.
Proof of this is:

1. UPnP works as expected. Client devices like PC/Phone can request via UPnP and the router successfully opens up the ports and close them when the session is over.
2. I use this firewall config on my router (in case you want to take a look): https://forum.mikrotik.com/viewtopic.php?f=2&t=172360

**Comment by miniupnp** [comment]
> > you should use tcpdump / tshark / etc. to see if the SSDP M-SEARCH packet is sent.
> > ```
> > $ sudo tcpdump -n -A "port 1900"
> > ```
> 
> My router (192.168.1.1) does not filter LAN to LAN traffic and multicast traffic between LAN is allowed.
> Proof of this is:
> 
>     1. UPnP works as expected. Client devices like PC/Phone can request via UPnP and the router successfully opens up the ports and close them when the session is over.
> 
>     2. I use [this ](https://forum.mikrotik.com/viewtopic.php?f=2&t=172360)firewall config on my router (in case you want to take a look):
> 
> 
> Below is the output
> 
> ```
> listening on eth0, link-type EN10MB (Ethernet), capture size 262144 bytes
> 16:18:07.451580 IP 192.168.88.2.43088 > 239.255.255.250.1900: UDP, length 327
> E..c..@...l...X......P.l.O..NOTIFY * HTTP/1.1
> HOST: 239.255.255.250:1900
> CACHE-CONTROL: max-age=100
> LOCATION: http://192.168.88.2:49153/description.xml
> NT: upnp:rootdevice
> NTS: ssdp:alive
> SERVER: Linux/3.10.14, UPnP/1.0, Portable SDK for UPnP devices/1.3.1
> X-User-Agent: redsonic
> USN: uuid:00000000-0000-1000-0000-D847328BFC10::upnp:rootdevice
> 
> 
> 16:18:07.558954 IP 192.168.88.2.43088 > 239.255.255.250.1900: UDP, length 327
> E..c..@...l...X......P.l.O..NOTIFY * HTTP/1.1
> HOST: 239.255.255.250:1900
> CACHE-CONTROL: max-age=100
> LOCATION: http://192.168.88.2:49153/description.xml
> NT: upnp:rootdevice
> NTS: ssdp:alive
> SERVER: Linux/3.10.14, UPnP/1.0, Portable SDK for UPnP devices/1.3.1
> X-User-Agent: redsonic
> USN: uuid:00000000-0000-1000-0000-D847328BFC10::upnp:rootdevice
> 
> 
> 16:18:07.666937 IP 192.168.88.2.43088 > 239.255.255.250.1900: UDP, length 336
> E..l..@...l...X......P.l.X.fNOTIFY * HTTP/1.1
> HOST: 239.255.255.250:1900
> CACHE-CONTROL: max-age=100
> LOCATION: http://192.168.88.2:49153/description.xml
> NT: uuid:00000000-0000-1000-0000-D847328BFC10
> NTS: ssdp:alive
> SERVER: Linux/3.10.14, UPnP/1.0, Portable SDK for UPnP devices/1.3.1
> X-User-Agent: redsonic
> USN: uuid:00000000-0000-1000-0000-D847328BFC10
> ```

the TCPDUMP output shows that there are NOTIFY packets from 192.168.88.2 but none from 192.168.88.1. There should be some. (UPNP devices usually broadcast NOTIFY every 30 or 60 seconds)

Also I don't see any M-SEARCH request. Have you tried `upnpc -s` during the dump ?

It's up to you to tcpdump at various location in your LAN to see where the SSDP NOTIFY are received from 192.168.88.1 and where they are not. That will help you spot where they are filtered out.
A suspect would be the TP-Link Access Point. It is configured in bridge mode but a bug might prevent it to forward multicast packets.

**Comment by pali** [comment]
Check if you have correctly configured firewall on machine where is upnpc running. See [README](https://github.com/miniupnp/miniupnp/blob/master/miniupnpc/README) file where is example of ipset/iptables configuration.

**Comment by daryll-swer** [comment]
> > > you should use tcpdump / tshark / etc. to see if the SSDP M-SEARCH packet is sent.
> > > ```
> > > $ sudo tcpdump -n -A "port 1900"
> > > ```
> > 
> > 
> > My router (192.168.1.1) does not filter LAN to LAN traffic and multicast traffic between LAN is allowed.
> > Proof of this is:
> > ```
> > 1. UPnP works as expected. Client devices like PC/Phone can request via UPnP and the router successfully opens up the ports and close them when the session is over.
> > 
> > 2. I use [this ](https://forum.mikrotik.com/viewtopic.php?f=2&t=172360)firewall config on my router (in case you want to take a look):
> > ```
> > 
> > 
> > Below is the output
> > ```
> > listening on eth0, link-type EN10MB (Ethernet), capture size 262144 bytes
> > 16:18:07.451580 IP 192.168.88.2.43088 > 239.255.255.250.1900: UDP, length 327
> > E..c..@...l...X......P.l.O..NOTIFY * HTTP/1.1
> > HOST: 239.255.255.250:1900
> > CACHE-CONTROL: max-age=100
> > LOCATION: http://192.168.88.2:49153/description.xml
> > NT: upnp:rootdevice
> > NTS: ssdp:alive
> > SERVER: Linux/3.10.14, UPnP/1.0, Portable SDK for UPnP devices/1.3.1
> > X-User-Agent: redsonic
> > USN: uuid:00000000-0000-1000-0000-D847328BFC10::upnp:rootdevice
> > 
> > 
> > 16:18:07.558954 IP 192.168.88.2.43088 > 239.255.255.250.1900: UDP, length 327
> > E..c..@...l...X......P.l.O..NOTIFY * HTTP/1.1
> > HOST: 239.255.255.250:1900
> > CACHE-CONTROL: max-age=100
> > LOCATION: http://192.168.88.2:49153/description.xml
> > NT: upnp:rootdevice
> > NTS: ssdp:alive
> > SERVER: Linux/3.10.14, UPnP/1.0, Portable SDK for UPnP devices/1.3.1
> > X-User-Agent: redsonic
> > USN: uuid:00000000-0000-1000-0000-D847328BFC10::upnp:rootdevice
> > 
> > 
> > 16:18:07.666937 IP 192.168.88.2.43088 > 239.255.255.250.1900: UDP, length 336
> > E..l..@...l...X......P.l.X.fNOTIFY * HTTP/1.1
> > HOST: 239.255.255.250:1900
> > CACHE-CONTROL: max-age=100
> > LOCATION: http://192.168.88.2:49153/description.xml
> > NT: uuid:00000000-0000-1000-0000-D847328BFC10
> > NTS: ssdp:alive
> > SERVER: Linux/3.10.14, UPnP/1.0, Portable SDK for UPnP devices/1.3.1
> > X-User-Agent: redsonic
> > USN: uuid:00000000-0000-1000-0000-D847328BFC10
> > ```
> 
> the TCPDUMP output shows that there are NOTIFY packets from 192.168.88.2 but none from 192.168.88.1. There should be some. (UPNP devices usually broadcast NOTIFY every 30 or 60 seconds)
> 
> Also I don't see any M-SEARCH request. Have you tried `upnpc -s` during the dump ?
> 
> It's up to you to tcpdump at various location in your LAN to see where the SSDP NOTIFY are received from 192.168.88.1 and where they are not. That will help you spot where they are filtered out.
> A suspect would be the TP-Link Access Point. It is configured in bridge mode but a bug might prevent it to forward multicast packets.

I am accessing this network remotely (2500KM) via site-to-site VPN, the Pi is the only device I can work with on the LAN, so I can't check from a secondary device. 

If you have any other suggestions that would be great.

As I mentioned before, UPnP from LAN to router works so that eliminates TP-Link as being the culprit. LAN devices can indeed reach 192.168.88.1's UPnP via multi-cast traffic over the AP mode device.

**Comment by daryll-swer** [comment]
> Check if you have correctly configured firewall on machine where is upnpc running. See [README](https://github.com/miniupnp/miniupnp/blob/master/miniupnpc/README) file where is example of ipset/iptables configuration.

Hi can you please provide a UFW equivalent of those rules? I am not good with translating the syntax from iptables to UFW. Thanks.

**Comment by miniupnp** [comment]
> I am accessing this network remotely (2500KM) via site-to-site VPN, the Pi is the only device I can work with on the LAN, so I can't check from a secondary device.
> 
> If you have any other suggestions that would be great.
> 
> As I mentioned before, UPnP from LAN to router works so that eliminates TP-Link as being the culprit. LAN devices can indeed reach 192.168.88.1's UPnP via multi-cast traffic over the AP mode device.

Well you have no access to the network, but you know for sure that UPnP from LAN works... that's means there is no problem ?

I'm afraid we can't help you if you cannot diagnose why your Pi does receive SSDP NOTIFY from your router.

**Comment by pali** [comment]
> Hi can you please provide a UFW equivalent of those rules?

No one. UFW does not support these kind of ipset / multicast features.
